{
  "asset_id": "arrow_probe",
  "variant_class": "probe",
  "source_format": "blend",
  "forward_axis": "+X",
  "up_axis": "+Z",
  "units": "meter",
  "origin_policy": "ground_footprint_center",
  "visual_objects": ["VIS_arrow"],
  "hit_proxy_objects": [
    {"name": "HIT_torso", "region": "torso"}
  ],
  "metric_proxy_objects": [],
  "sockets": ["origin"],
  "clips_states": [
    {"state": "idle", "frames": 1, "playback": "loop", "directional": true}
  ],
  "notes": "M1/M2 direction probe (P2). No armature; 16 directions; placeholder metrics."
}
